ID,CODE,NAME,DESCRIPTION
1,SingleChoice,Single choice,Use this type of question to choose one answer from a list.
2,MultiChoice,Multi choice,Use this type of question to choose one or more answer from a list.
3,RatingScale,Rating scale,Use this type of question to rate something.
4,Comment,Comment,Use this type of question to aquire feedback.
5,ReorderItems,Reorder items,Use this type of question to reorder items.
6,SumDistribution,Sum distribution,Use this type of question to disribute weights across several items/options.
7,Template,Template,Use this type of question to clone questions from a template.
8,DateInput,Date Input,Use this type of question when the answer to be given is a date or a date/time.
